本文,Level
道が分かりにくいので、私が一緒に行きますね。,3
区役所は、交差点を左に曲がり、右側に見える。,3
ゴールデン・ブリッジを渡れば、すぐに見えるよ。,3
信号を渡る時は、よく注意してね。,3
段差あるので、通行に注意してね。,3
シベリヤ鉄道で大陸を横断したんだってね。,3
道に迷った？,3
大僧正は、今、亡くなられたよ。,3
係長は、ニューヨークで死んだよ。,3
先生は、お子さん達に見守られて亡くなったよ。,3
とうとう亡くなったけれど、１００歳まで生きたなら、早すぎるってことはないね。,3
老師は、百歳まで長生きして亡くなったんだよ。,3
先生は、たった今、亡くなられた。,3
穏やかに眠ってるみたいな顔で死んだよ。,3
お父さん、いくつで亡くなったの？,3
大臣は、任期の途中で死んだね。,3
お互い、いつ死んでもおかしくない年だからなあ。,3
さあ、お爺ちゃんに何か言ってやらないと。,3
出棺だよ。手を合わせて見送るんだ。,3
今年の春はぴんぴんしてたのに、コロっといくなんて信じられないよ。,3
勿体ない人が亡くなったもんだ。,3
警部が殉職してもう十年か。,3
明日は、キリスト昇天の日だよ。,3
先代は残念ながら死んでしまった。,3
あの若さで死んでしまうとは残念。,3
この年の瀬の不幸、何かと大変だね。,3
昨日、会長が死んだの。,3
消え入るように死んだ。,3
奥さんが亡くなってもう7年？,3
お母さんを最期を看取ったの？,3
シスターは静かに死んだ。,3
中也さんも惜しまれながら死んでしまった。,3
そろそろ命日じゃない？今年は何回忌？,3
今朝、海岸で死体が見つかったらしい。,3
御忌日には、必ず法華堂へ参拝しているよ。,3
この崖から転落などしたら、ひとたまりもないね。,3
祖母たちは、心から御浄土を信奉していたよ。,3
先生のお言いつけ、必ず守るよ。,3
旦那様は、たくさんの用事を言いつけた。,3
親方の仰せは、道理に適ってたよ。,3
社長から、お供するよう言われてる。,3
何でも言ってね。,3
必ず、言う通りにする。,3
先生の言った通りする。,3
先生に従ってりゃ、間違いはない。,3
幹事長には、選挙の準備を始めるように言ったんだね？,3
商品の偽装は、社長のあんたが命令したんだね？,3
監督、最終回の守りは見事な采配でだった。,3
適切な指示をもらって、恐縮だ。,3
こんなふうに指示したのは、なぜか？,3
オリンピック報道を、指揮するそうだね。,3
祭りを取り仕切るのは、大変だろうね。,3
お仕着せの規則は反発されるだけだよ。,3
そんなルールで縛っても、私は自由にさせてもらう。,3
きつい指示、本当に深く心に感じ入る。,3
あちらだけお咎め無しじゃ、不公平じゃない？,3
何でまた、規則を破ったんだ？,3
自分の健康ぐらい、しっかりと管理しとけよ。,3
謹慎中の身なんだから、外出は控えろよ。,3
先輩は京都の寺にこもって、謹慎するそうだ。,3
法令は厳しくも守れよ。,3
法令を遵守るのが企業の務めだからね。,3
審議はまだ半ばだよ、これからが山場だで。,3
門限破りはご法度でだよ。,3
あなた、私を支配なしようなんてとんでもないことだ。,3
ゴミ屋敷には、どんな法律を適用したんだ？,3
あいつが、ハワイを統治した王様の末か？,3
お待たせ、お昼の支度ができたよ。,3
そろそろ支度したらどう？,3
式のお膳立ては、私たちに任せろ。,3
手配してくれたこと、ありがとう。,3
チケットを手配するなら、早い方がいいよ。,3
手筈は、すべて調えている。,3
パーティーは、私たちが全部整える。,3
結婚式の式服を調えた。,3
娘さんの嫁入り道具は、もう調えましたか？,3
転勤の準備は済んでるか？,3
受験は、早めに準備した方がいいよ。,3
紙と鉛筆を用意しろ。,3
会場には、皆の弁当を用意している。,3
祝いの品は、もう用意したか？,3
普段から万が一に備えているのは、いい心がけだね。,3
それはおめでとう、喜んで参加するよ。,3
何のお構いもできないけど、気軽に出かけてね。,3
全然連絡がないから電話したよ。,3
祝賀の催しは私たちにも声をかけてね。,3
明日の朝、絶対来てね。いいお知らせがあるよ。,3
人気者にはいつも、真っ先に声がかかるんだよ。,3
この次はあなたも誘うね。/来月の会に誘うね。,3
やっぱりあなた、彼女を誘うつもりだね。,3
疲れたでしょ？お茶にしようか。,3
今日は暇？映画でも観ない？,3
今日は誘ってくれてありがとう。,3
来週のパーティーに、あなたを誘いたいんだけど。,3
お呼ばれは何度でもうれしいね。/今日はお呼ばれ？,3
彼をここに呼ぼうか？,3
当直の先生から、呼び出しがあるかもよ。,3
故郷の粗酒だけど、みんなで飲んでね。,3
先生は本当に、お酒が好きなんだねえ。,3
ビールが冷えてるよ。/とりあえずビールだね。,3
今日は特別の日だから、御酒でも飲もう。,3
今日は冷えるから、お湯割りにしよう。,3
私がお燗番をするよ。/お燗がつくまで少し待ってね。,3
そんなに飲んだら体に毒だよ。,3
ご隠居はお酒を飲むとき、とても嬉しそう。,3
今夜も飲んでたんだね。顔が赤いよ。,3
お酒も、嗜む程度ならいいんだけどね。,3
まあそんなに酔って、お冷どうぞ。,3
今日はいつになく酔ってるみたいだね。,3
おっとっと、やっぱり酒は口から迎えに行かなくっちゃ。,3
ママが、お酌をしながらそっと囁いたのには驚いたよ。,3
そろそろお開きにしようか。明日は早いから。,3
お近づきの印に、一杯いかが？,3
出版を記念して、一杯行こうと思う。,3
それじゃあ、相伴させてもらうよ。,3
係長、駆けつけ三杯、注ぐよ。,3
それじゃあ、お流れ頂戴するよ。,3
お流れ頂戴したからご返杯を。,3
先輩から、お杯をもらってしまったわ。,3
お酒は強いほう？,3
ウイスキーには弱いの？,3
手際が悪くて悪いね。/生憎手際が悪くてね。,3
ご愛敬に、一曲唄うね。,3
指名されたから、一曲唄うね。,3
新入社員にお座敷芸を強要するのはひどいよ。,3
先日の宴会はすごい盛り上がったんだってね。,3
その宴会は三日三晩続いたそうだよ。,3
味はどう？ちょっとあなたには物足りないかしら？,3
砂糖はいくつ？,3
お代わりいる？/遠慮なくお代わりしてね。,3
何か嫌いなものある？,3
口直しにシャーベットはどう？,3
口に合うかわからないけど。,3
好きなものをとって食べてね。,3
準備ができたから部屋へどうぞ。,3
松茸ご飯、私が取ろうか？,3
冷たい飲み物でも持ってこようか？,3
何のおもてなしもできないけど。ゆっくりしていってね。,3
うちの店自慢の羊羹だよ。食べてみてね。,3
何もないけどゆっくりしていってね。,3
何もないけど、食べてね。,3
冷めないうちに食べてね。,3
寿司は別腹だから喜んでいただきます。,3
喜んで相伴にあずかるよ。,3
こんなに美味いワインは久しぶりだわ。,3
先輩の手料理、すごく美味しかったよ。,3
心のこもった手料理、堪能したよ。,3
先生が料理を作ってくれるなんてもったいないよ。,3
もう十分食べたよ。お腹いっぱい。ご馳走さま。,3
おもてなし、ありがとう。,3
おもてなししてくれて、ありがとう。,3
ごちそうさま。,3
ごちそうさま、すごく美味しかったよ。,3
悪いね、すっかりごちそうになっちゃって。,3
ごちそうさま、すごく美味しくいただいたよ。,3
いいえ、どういたしまして。,3
簡単なもので悪いね。,3
念のため、ゆっくり数えてみて。,3
私の分も足してね。,3
この前の件の見積もりの用紙を持ってきた。,3
ポスターの印刷費の見積もりをするね。,3
イベントの実行予算の計算は、細かい所まで正確にやってください。,3
研修旅行の費用も、予算内に含めているんだよね？,3
その土地を、もう一度計測したら？,3
今月の経費の集計をしてね。,3
今期の決算の結果はどうだった？/決算は終わった？,3
その新しい事業で、採算が取れるの？,3
算定基準はどこですか。,3
算定するなら、しっかりとした基準が必要だね。,3
去年度の収益はどうだった？,3
オプショナルツアーは別料金だよ。,3
ご名算！と言えば算盤を思いつくね。,3
専務、契約書の草案を作ってくれ。,3
役割分担をした方がよいと思う。,3
初の取引だが、契約するよ。,3
新規の契約をしてくれて、ありがとう。,3
もう少し値引きをしてくれるなら、契約するよ。,3
契約してくれるのは誰ですか。,3
早めに契約解消したのは良い判断だと思う。,3
契約を解除する前に、注意事項をよく読んでくれ。,3
早めに解約した方が良いよ。,3
いま解約するのは損だと思うよ。,3
契約書を書き直してくれ。,3
明日の朝までに修正してくれ。,3
ここを直した方が、ずっと良くなると思うよ。,3
契約書の訂正をする？,3
こことここに捺印してくれ。,3
先生は万葉集の専門家だ。,3
先生は二十世紀最大の数学の難問をついに解いた。,3
万葉の研究をより深めるため、奈良に移るそうだね。,3
金融不安に関しての先生の意見を聞かせてくれ。,3
この句を、そう解釈した理由を教えてくれ。,3
この論文は、今までの研究の成果なんだね。,3
博士は何を研究しているの？,3
江戸文化に関しての先生の考察、よく分かりました。,3
新しく構築されたシステムは、本当に素晴らしい。,3
先生が構築された理論に、誰も意義を唱えることができない。,3
何十年も続けて実験した熱意には、頭が下がる。,3
専門は仏文学なのか、どうりでフランス映画に詳しい訳だ。,3
大学院では日本画を専攻したと聞いてますが。,3
専門は江戸の遊郭史なんだ、面白そうだね。,3
生命科学が、先生の専門分野だ。,3
この件はしばらく考えさせてくれ。,3
今日はこれでこの話を終わろう。,3
もう少しよく考えた方が良いと思うよ。,3
その件に関しては、しばらく考えさせてくれ。,3
もう少し時間をくれないか。,3
どうぞじっくり手にとって見てください。,3
じっくり考えて検討した方が良いと思う。,3
もう少し検討させてくれないか。,3
例の件、なんとか考え直してくれないか。,3
もう一度ゆっくり考え直してくれないか。,3
そこで先生は思案を巡らせた。,3
部長はなにかいいアイデアがないか考え中だ。,3
そうなんだ、念のため聞いておこう。,3
大阪の一件は、棚に上げるつもりなの？,3
先生は返事を先延ばしにした。,3
先生は丸々二時間演説する予定だ。,3
そんな風に公言を恐れているようなこと、有権者は忘れていないよ。,3
大臣は確かに年金は百年安心と言ってた。,3
党の選対から、公認が得られなかったようだね。,3
減税の件は、公約の柱のひとつではなかったかな…。,3
公約として掲げたのだから、責任もって遂行してくれ。,3
遂に出馬することになったんだね。,3
若手は、君が出馬することに期待しているよ。,3
当選確実だ。/当選おめでとう。,3
息子さんが市議議会議員に当選したそうじゃないか。,3
党首は激戦区での遊説に行った。,3
書記長は、全国各地で遊説しているよ。,3
与党は頼りないけど、支持するの？,3
本気で政権を取るつもり？,3
落選したからといって、そんなにがっかりしないで。,3
給料が入り次第、返すね。,3
今年中に何とか、返済してもらいたいんだけど・・・。,3
宝くじを当てて、ローンを一括返済したんだって？,3
困ってそうだから、貸してあげるよ。,3
お金を貸すことは、友人を失くすことだよ。,3
それでは、ありがたく借りるね。,3
ちょっと借りていい？,3
現金はどれだけ必要なの？,3
あの借金を肩代わりするとは、太っ腹だね。,3
漁労長、五万円ほど、融通きかない？,3
ちょっとお金貸してもらってもいい？,3
じゃあ、あなたを信用して、貸してあげる。,3
何度も催促もらって申し訳ないけど、もうちょっと待ってほしい。,3
催促がましくて申し訳ないけど・・・。,3
あの人には、そろそろ催促する方がいいよ。,3
頭、本祭りには多くの寸志をもらって大助かりだよ。,3
お賽銭を盗む奴がいるというのは驚くよね。,3
たくさんの寄付をありがとう。,3
あそこへは相応に寄付したほうがいいよ。,3
先代は社の発展を願って、社殿を寄進した。,3
社長は、感謝の気持ちを込めて、大神輿を寄進した。,3
ご寄贈の品、ありがたく頂くよ。,3
毎年、車椅子を寄贈しているそうだね。,3
盲導犬普及のために寄付してもらってありがとう。,3
神輿改修のため、先生はかなりの額を寄付したらしいよ。,3
あの大臣の凸凹会に献金してるらしいね。,3
会長から多額のご芳志をもらったよ。,3
お客さんへのご報謝を用意しておいてね。,3
毎年、お祭りにはお酒を納めてるらしいね。,3
遺言で、赤十字に募金するんだね？,3
不足分を払ってくれる？,3
ちょっと待って、すぐに払うね。,3
税金を払うなら、この伝票だよ。,3
食事代は部長が払ったよ。,3
現金で払うね。,3
支払窓口は、1番から3番だよ。,3
一年間会費を滞納すると、自動的に除名だよ。,3
月謝忘れてる人いない？,3
今月分の家賃を持ってきたよ。,3
宿泊料のうち、消費税分をサービスしてるよ。,3
このツアーの料金は、一人十万円だよ。,3
息子くんの留学の費用も大変だよね。,3
食べ盛りの子供が大勢で、出費がかさむね。,3
忘年会の予算どのくらい？,3
初めての給料でお母さんにスカーフをプレゼントしたんだって？,3
証券関係の仕事だと、給料もいいんだろうね？,3
先生への車代は、どのくらいにすればいいんだろう？,3
スタッフにまで十分すぎるお心遣い、ありがとう。,3
おこづかいは大事に使わないとだめだよ。,3
留守番を頼んだからお礼払うね。,3
教授がお茶代を払ってくれたよ。,3
子どもの頃、お使い賃を貯めてはプラモデルを買ったものだなあ。,3
みんなへの手当は大丈夫？,3
お年玉はお母さんに預かってもらおうね。「嫌だよ」,3
今日はたくさんお捻りをもらえて、良かったね。,3
大僧正が来てくれたんだから、お布施をはずもう。,3
ご祝儀包んでおいてね。,3
ご収入が急降下、そりゃ大変だ。,3
親方は、報酬より仕事の中身が大事だと言ってるよ。,3
歯が痛むの？/アキレス腱はまだ痛いの？,3
転んで足を痛めたってきいたけど。,3
ひどい転び方、鎖骨でも折ったんじゃない？,3
どうしたのその傷、猫にでも引っかかれたの？,3
怪我の具合はどう、とんだ災難だったね。,3
転んで怪我したの、何か考え事？,3
自転車で転ぶなんて、危ないね！,3
よく転ぶね。上げたつもりの足が上がってない。,3
おできの痕が、今でも背中に残っているんだよ。,3
しばらくお酒のまなければ、出血の心配はないよ。,3
摂生しないと、また胃から出血するかもしれないよ。,3
よく骨折するんだね、今度は肋骨？,3
その病気、失明する心配はないの？,3
初めにきちんと手当しないと、長引くよ。,3
あなた、彼女をとても嬉しそうに介護していたよ。,3
あの店でのコース料理はつまらないよ。,3
白魚のおどりを食べたことがある？,3
あの店の懐石コースもう食べた？,3
さすが京の老舗、とても美味しかった。,3
松坂牛のすき焼きを、味わってね。,3
区切りのいいところで、ご飯を食べない？,3
しばらくは、布団でお粥を食べることだね。,3
エスカルゴ、食べれる？,3
瀬戸内の肴を準備したから食べてみて,3
お坊さんは健康のため、毎日蜂蜜を食べているみたい。,3
野菜を残しちゃダメ。,3
よく混ぜてから食べてね。,3
何を飲む？,3
のどが渇いたから、お水を一杯ください。,3
お水を一杯ください。,3
担当のものは別室にいるので、電話を回すね。,3
今他の電話で話しているよ。,3
ちょっと待ってもらってもいい？,3
わざわざ電話してくれてありがとう。,3
今外出しているよ。,3
良かったら私が用件を聞こうか？,3
ごめん。よく聞こえなくて、もう一度言ってくれない？,3
戻って調べてから、また電話するね。,3
いっつも電話で邪魔しているね。,3
担当者が戻ったら、折り返し電話させるね。,3
伝言を残したいのだけど、メモしてくれる？,3
分かった。じゃあ、電話があったって伝えるね。,3
番号が違うけど、何番にかけたの？,3
電話代わったよ。用事を訊くよう言われたけど。,3
聞きたいことって、何？,3
今はじっと我慢よ。動くときはきっとくる。,3
油絵の個展、したんだって？,3
今は動かない方がいいよ。,3
うん、それで進めてね。,3
このプロジェクトの推進役は、君以外にないよ。,3
会長、開発計画を進めるチャンスだと思うよ。,3
十年先を考えて、するのだね。,3
夜遅くまで研究してた姿を思い出すよ。,3
いよいよ新しい事業を始めるんだね。,3
弓を始めたのは、精神修養の為かい？,3
これも君がしたんだね。,3
ドイツの企業との取引を広げるの？,3
二代目は、オフロードレースへの挑戦を思い立った。,3
とうとう、ストを始めるんだね。,3
それなら、早く動いた方がいいよ。,3
しょうがないね。いつも会計前にいなくなるんだから,3
山に籠るのだね。来季に備えて。,3
部屋に籠って、何を祈っていたの？,3
なんでそんなに私を避けるの。,3
地震の時、どこに逃げてたの？,3
実りのない会議とは、さっさとおさらばしたいよね,3
リハビリ、怠けちゃだめっていわれちゃった,3
釣った魚、逃がすの？優しいね。,3
はよ逃げろ追っ手が来る,3
突然の地震で、命からがら逃げたらしいね。,3
責任から逃げるの？君らしくない。,3
玉突き事故を免除されたんだって。よかったね。,3
ストレスをさけるのが先だよ。,3
不当な退職勧告は、すぐ拒否したほうがいいよ。,3
クラブのホステスと逃げるなんて困った人だね。,3
あの人の祈る姿は凄まじかったよ。,3
幸せを心から祈るよ,3
一心に祈れば、きっといいことがあるよ,3
頼んだこと、宜しくね,3
君が知恵を入れたんだね,3
助けると思って、楽にしてよ,3
神様、一生のお願いだから。絶対当ててね。,3
お不動様お願い。あの子を守って。,3
これって神様の恵みなんじゃない？,3
気休めだけど、馬頭観音に御祈願してみたら？,3
今年も、お不動さんに家内安全を祈るんだね。,3
じゃあ、順に御祈祷をして。,3
機会があるたびに加持祈?するなんて、いい心掛けだね。,3
プロジェクトの成功、祈っているよ。,3
本気にしちゃだめだよ、お愛想だけなんだから、あいつは。,3
そんな歯の浮くようなお世辞は、ごめんだよ。,3
あの人はお節介焼きで有名。,3
そんなお為ごかしは聞きたくない。,3
いつもいつも、お調子者で困ったね。,3
取り巻きのお追従に気づくだろうね、会長は。,3
お追従者は、どこの社会にもいるものだよ。,3
あの人は少しお天気屋なところがあるからね。,3
あのおべっか遣いには本当に困ったもんだ。,3
見え透いたおべんちゃらを言うのはやめろ。,3
あの人は、いつも権力に迎合する、困ったやつだ。,3
君はご機嫌取りが上手だから、よろしく頼むよ。,3
あの評論家のご都合主義には目に余るものがあるね。,3
あの人には、まるで定見がないね。,3
私は説を曲げないよ、たとえ御用学者と呼ばれたって。,3
気が若いなぁ、若い娘を集めて大騒ぎするとはね。,3
あの人は、他人の迷惑なんてお構いなしだよ。,3
嫁さんは口数が多くて、機関銃のようだからね。,3
ちょっと声が高いんじゃない？周りに迷惑だよ。,3
びっくりしたわ、急に叫ぶから。,3
異動の季節、役所の中が何かと騒がしいようだね。,3
そんなに騒ぐようなことではないと思うが・・・。,3
あの三人組のお喋りには、ほとほと参った。,3
みんな賑やかだね。,3
何かいいことがあったんだね、そんなにはしゃいで。,3
あの人は、性格も派手だからね。,3
あの連中のお祭り騒ぎを何とかしてよ。,3
毎度、うるさくて、ごめん。,3
先生も日本の決勝ゴールに歓声をあげていた。,3
あること無いこと吹聴するのはやめろ。,3
これからも変わらず、私たちを援助して。,3
そういう事情なら、私たちが援助するよ。,3
恩を売るというんじゃなく、この際援助したら？,3
今度は、私が君を支える番だから。,3
君がこの老舗を支えてきたんだよ。,3
君を救うには、この方法しかなかったよ。,3
先生の植林技術が、中央アジアの山村を救ったんだ。,3
大恩ある君を助けるのは、当然のことだ。,3
みんなが力を合わせて助けたそうだね。,3
手出しはするな。,3
ゴミ問題解決のため、ここは隣町と協調するべきだ。,3
御社に応援してもらえたら、鬼に金棒だ。,3
今年も、地元のお祭りを後援するんだね。,3
なにとぞ、温かい支援をしてください。,3
今年度も、あのプロジェクトを支援するの？,3
退職後は、悠々自適で畑仕事に汗を流しているそうだね。,3
いよいよ還暦かい。お愉しみはこれからだね。,3
孫の成長が楽しみだね。,3
それでは豪華賞品が当たるビンゴを楽しんでね。,3
沖縄では、スキューバダイビングをする予定なの？,3
慰みに、ジグソーパズルはどう？,3
趣味はバロック音楽の鑑賞なんだってね。,3
市川崑監督のシリーズを、じっくり鑑賞して。,3
中国雑技団の公演、ゆっくり観覧できた？,3
結構な趣味だね、油絵を描くなんて。,3
洋ラン展、堪能した？,3
嫁さんと桜の旅を堪能したんだってね。,3
ウイーンでオペラを満喫だって、優雅なもんだね。,3
信州で夏の休暇を満喫したんだって。,3
最近、碁をやっているんだって。,3
いつまでも両親に依存するのは恥ずかしいぞ。,3
遺言状を弁護士に委託したそうだね。,3
依頼の品を届けに来た。,3
調査を依頼する人は、この書類に記入しなさい。,3
ここは隠居にすがって、相談にのってもらうしかないな。,3
息子のこと、何ぶんよろしく頼む。,3
あんな奴に頼むことはないよ。,3
いつも君に頼るばかりですまない。,3
使い立手して悪いけど、この本を先生に届けてくれ。,3
今回の選挙も、一票のお願いに来た。,3
何とか、力添えを頼みたいが。,3
都知事への請願、どどうだった？,3
荒れた河川敷の改修を区に請願するべきだ。,3
代表監督への就任を、請願したそうだね。,3
そこまで若手に委ねるのは考えものだよ。,3
華奢な身体で、とっても羨ましいな。,3
坊ちゃん、身長がとってもと伸びたね。,3
身長は、百八十センチは超えたかな？,3
ふくよかで、性格も丸い方なんだろうね。,3
心配事が無くなって、ふくよかになったみたいね？,3
