本文,Level
その後国内での評価が高まり、キネマ旬報で10年毎に批評家らが選出した「日本映画史上のベスト・テン」では、1979年、1989年、1999年でいずれも1位に選ばれた。,2
本作は海外の映画批評家からも高く評価された。,2
アーサー・ナイトは『ザ・サタデー・レビュー』で、「ディテールの多さ、人物描写の豊かさ、アクションの力強いクオリティ、そしてすべてのシークエンスで黒澤が見せる技術面での妙技、それらがこの作品の尽きない魅力となっている」と評した。,2
ロサンゼルス・タイムズ紙のケヴィン・トマスは、「『七人の侍』の息が長いのは、演出スタイルが華麗であるからではなく、皮肉なスタイルを交えながらも、人生と人間らしい心を強く肯定したメッセージが、高らかに宣言されているからである」と肯定的に評価した。,2
ワシントン・ポスト紙のデッソン・トムソンは、「史上最高のアクション映画」としている。,2
ロジャー・イーバートは本作に最高評価の星4つを与え、自身が選ぶ最高の映画のリストに加えている。,2
映画批評集積サイトのRotten Tomatoesには86件のレビューがあり、批評家支持率は100%で、平均点が9.60/100という高評価を獲得している。,2
同サイトの「アートハウス＆国際映画トップ100」では3位、「アクション＆アドベンチャー映画トップ100」では10位にランクされている。,2
Metacriticには6件のレビューがあり、加重平均値が98/100となっている。,2
アンドレイ・タルコフスキーは好きな作品の1本に挙げており、雨や土などの自然描写に影響を受けた。,2
ジョージ・ルーカスはUSCの映画学科で学んでいる時に、本作を見て大きな衝撃を受けた。,2
後にルーカスは「『七人の侍』は私に途方もない衝撃を与えた。,2
私はそれまであのように力強く、しかも映画的なものを見たことがなかった。,2
私がその文化や伝統を理解していない事など問題にならないくらい、とても激しく感動した」と語っている。,2
ジョン・ウーは映画を撮る前に必ず本作を見直しており、「あらゆるアクション映画の模範であり、私にとって教科書のようなものです」と語っている。,2
また、マーティン・スコセッシは「若手映画製作者のための39本の外国語映画」のリストに選出した。,2
テリー・ギリアムも自身の人生と作品に影響を与えた映画の中で、「映画を監督したいと思わせた映画」として選出した。,2
ほかにも、ジョン・ミリアス、ジョン・ブアマン、ジム・ジャームッシュ、北野武、アンドレイ・コンチャロフスキー、リチャード・レスター、マーティン・マクドナー、ポール・グリーングラス、ジョージ・ミラー などが、本作を好きな作品に挙げたり、ベスト作品の1本に選出したりしている。,2
元々は主演のユル・ブリンナーが映画化の話を持ちかけ、プロデューサーのウォルター・ミリッシュが東宝から正式に権利許諾を得て映画化した。,2
その後、『荒野の七人』の続編として、 1966年公開の『続・荒野の七人』、1969年公開の『新・荒野の七人 馬上の決闘』、1972年公開の『荒野の七人・真昼の決闘』が作られた。,2
また、本作を基にした『荒野の七人』のリメイク作として、1980年公開のジミー・T・ムラカミ監督作『宇宙の7人』、2016年公開のアントワーン・フークア監督作『マグニフィセント・セブン』がある。,2
他にも多くの外国映画に影響を与えた。,2
アクションシーンでスローモーションを使用する手法は、1967年公開のアーサー・ペン監督作『俺たちに明日はない』と、1969年公開のサム・ペキンパー監督作『ワイルドバンチ』に影響を与えた。,2
マカロニ・ウエスタンには1965年公開のマルコ・ヴィカリオ監督作『黄金の七人』など、本作の形式だけを借りた作品も多い。,2
香港や台湾の武侠映画では、1975年公開のキン・フー監督作『忠烈図』や、1984年公開の王童監督作『策馬入林』などに影響を与えた。,2
1975年公開のラメーシュ・シッピー監督のインド映画『炎』は、本作と『荒野の七人』のスタイルやストーリーの影響を受けている。,2
ロサンゼルス・ヘラルド・エグザミナー紙は、ハリウッドの映画監督に与えた影響について、「監督がこの作品のために編み出した、鮮やかなアクション技術、つまりマルチカム撮影や、戦闘シーンのスローモーション撮影、ロングレンズを使用した群衆の強調技術は、その後何十年にもわたり、多くの映画監督に多大な影響を与えてきた。,2
黒澤らしい発案は、アーサー・ペンやサム・ペキンパー、ウォルター・ヒル、フランシス・フォード・コッポラ、ジョージ・ルーカス、ジョージ・ミラーなど、才能あふれる『侍』ファンの、ベーシックな技術となった」と述べている。,2
特にスター・ウォーズシリーズでは、本作の影響を大きく受けていることが知られ、派生作品のローグ・ワン/スター・ウォーズ・ストーリーは、監督を務めたギャレス・エドワーズが、来日の際の記者会見で、本作に影響されたものと語っている。,2
シルヴェスター・スタローン、ジェイソン・ステイサム、ジェット・リーなど主役級のアクション俳優が共演した『エクスペンダブルズ』（2010年）も『七人の侍』をヒントに製作したとスタローンは述べている。,2
本作は日本国内の漫画やアニメにも影響を与えた。,2
富野由悠季原作の漫画『機動戦士クロスボーン・ガンダム 鋼鉄の7人』(2006～07年連載)は本作がイメージのベースとなっている。,2
1984年放送のテレビアニメ『キン肉マン 決戦!7人の正義超人vs宇宙野武士』の大筋は本作のパロディとなっている。,2
2004年放送のテレビアニメ『SAMURAI 7』は本作のリメイクだが、物語設定は原作通りではなく、未来の惑星戦争の世界を舞台とするSF冒険活劇となっている。,2
アニメ映画では、1997年公開の『クレヨンしんちゃん 暗黒タマタマ大追跡』に登場する「珠由良七人衆」が七人の侍をモデルにしており、2015年公開の『名探偵コナン 業火の向日葵』に登場する「7人のサムライ」が本作に由来している。,2
また、海外のアニメーション映画にも影響を与えた。,2
1998年公開のピクサー映画『バグズ・ライフ』は本作との類似点が指摘されている。,2
2010年放送のアメリカのテレビアニメ『スター・ウォーズ/クローン・ウォーズ』第2シーズンの第17話「七人の傭兵」は本作をオマージュしており、本編冒頭に「in memory of Akira Kurosawa」のテロップが挿入されている。,2
2018年公開のウェス・アンダーソン監督作『犬ヶ島』には、早坂が作曲した「勘兵衛と勝四郎～菊千代のマンボ」がサウンドトラックで使用された。,2
2018年に結成したジャニーズJr.のグループ「7 MEN 侍」のグループ名は、ジャニー喜多川が本作から名付けた。,2
フジテレビでかつて放送されていたバラエティ番組「めちゃ2イケてるッ!」で2000年3月から1年ほど放送されていたゲームコーナー「七人のしりとり侍」はこの映画のタイトルを捩ったものであり、ナインティナイン、極楽とんぼ、よゐこ、武田真治の7人が扮する登場人物も、映画の登場人物である侍7人の名前を捩ったものであった。,2
主に成人向け漫画作品を中心に一般向け漫画作品や書籍表紙イラスト、アダルトゲーム作品のキャラクター原画なども手がけている。,2
入選はしなかったが担当がつき、アシスタント経験を勧められ、藤子不二雄Ⓐの藤子スタジオを紹介された。,2
藤子不二雄Ⓐの株式会社藤子スタジオ（ふじこスタジオ）でアシスタントを3年ほど務めたのち、漫画賞を受賞するも、デビューには繋がらず、さらに2年余をアシスタントと複数のアルバイトをしながら過ごした。,2
2005年頃から実話誌での（原作つき）漫画執筆で商業漫画家として活動を始めた。,2
その後は成人漫画誌へ活動の場を移し、人妻ものやギャルものを扱った成人漫画誌などで連載を持った。,2
当時のペンネームは現在のものとは違う。,2
2010年華漫GLOD（ワニマガジン社）誌上でペンネームを奥森ボウイと改名し、同時に一新した絵柄が現在の画風につながっている。,2
デビューから1年後、初単行本が出るまでは成人漫画執筆と並行して、書店員として働いていた。,2
2015年より連載が開始されたウェブ配信の成人向け連載漫画『俺得修学旅行～男は女装した俺だけ!!』（forcs）がスマッシュヒットとなり、2018年5月にシリーズの総ダウンロード数が累計1000万DLを突破した。,2
同年、同氏の病気による入院により半年間の休載を挟んだが、作品自体は2019年8月に全29話で無事完結を迎えている。,2
書籍化した『俺得修学旅行』も本編全3巻で累計10万部を突破している。,2
運営母体は、製紙業会社の日本製紙。,2
1993年4月1日、本社の合併に伴い日本製紙が発足し、チーム名を『日本製紙旭川硬式野球部』に改称した。,2
森下は各地のカレー店を食べ歩いて詳細なメモをつけているほか、手作りのオリジナルカレーを大勢にふるまうこともある。,2
カレー以外の料理はまったく作れないと自嘲する。,2
2009年8月に『焼肉とチーズフォンデュの店 焼肉森下千里』を埼玉・大阪・兵庫にそれぞれ開店したが、現在はすべて閉店している。,2
ゴルフは片山晋呉プロのゴルフ番組へのゲスト出演をきっかけに始め、2017年時点でベストスコアは80でティーチングプロ資格を有する。,2
"変奏（英: Variation, 独: Variation）とは、主題のリズム、拍子、和声などを変えたり、旋律にさまざまな装飾を付けるなどして変形することである。",2
"欧米の言語では変奏 (Variation) の複数形（英: Variations, 独: Variationen, 仏: Variationsなど）が「変奏曲」の意味になる。",2
このラウンドからは、1回戦に勝利した35クラブに加え、UEFAチャンピオンズリーグ・UEFAヨーロッパリーグに参加するプレミアリーグ (1部)の7クラブが参加する。,2
なお準決勝は従来ホーム&アウェー方式で行われていたが、今年度は他のラウンド同様ワンマッチ方式で実施される。,2
「Retina」（レティナ）は英語で「網膜」という意味で、画素が細かく人間の目で識別できる限界を超えている、ということから命名された。,2
それ以降に発売された全モデルに搭載されている。,2
"また、iPhone SE (第1世代)を除くiPhone 6以降のiPhoneにおいては「Retina HDディスプレイ」、iPhone XRとiPhone 11のディスプレイは、もっとも先進的・正確な色を表示する「Liquid Retina」と名付けられているほか、OLEDディスプレイのiPhone X, XS/XS Maxでは「Super Retina」または「Super Retina HDディスプレイ」、11 Pro/11 Pro Max, 12/12 mini, 12 Pro/12 Pro Max, 13/13 mini, 13 Pro/13 Pro Max, 14 Pro/14 Pro Max,15/15Plus,15Pro/15 Pro Maxの全モデルでは「Super Retina XDRディスプレイ」と名付けられている。",2
なお、御殿は綱吉が将軍職に就任後、金乗院住職に譲られ、その材木を利用して同院の改築に充当されたという。,2
また錦はかつて田柄川が流れ、その下流一帯地区だった。,2
同川は隣接する城北中央公園先で石神井川と合流していた。,2
錦地区では1980年（昭和55年）から81年（昭和56年）に暗渠化し、旧田柄川緑道（グリーンベルト）として整備されその姿を消した。,2
但し今も緑道下を下水道幹線として流れる。,2
戦時中は陸軍専用輸送線（戦後は東武啓志線）が走り、隣接する練馬駐屯地に練馬倉庫駅（啓志線になってからの名称）が置かれた（1959年廃止）。,2
因みに錦を流れる田柄川や、錦2丁目付近を走る蒸気機関車と轟音に耳を塞ぐなどする子どもの写真は練馬区が所蔵している。,2
因みに錦の旧町名である仲町は今も練馬区立仲町小学校など隣接町に残っている。,2
構想路線として、環八通りの地下を通るエイトライナーがあるが、詳細な経由地や駅の位置などを含め具体化していない。,2
パースはベトナム戦争においてトンキン湾のヤンキー・ステーションで空母への航空警戒任務に従事し、シードラゴン作戦に参加、その他パイロットの捜索救助、支援艦砲射撃任務を行った。,2
パースはベトナム戦争での戦功でアメリカ軍の殊勲部隊章および部隊勲功章を受章した。,2
パースは1999年10月15日に退役し、西オーストラリア州のオールバニで潜水スポットとして2001年11月24日に沈められた。,2
正式名称は佐久市天体観測施設（さくしてんたいかんそくしせつ）である。,2
臼田宇宙空間観測所の所在地である南佐久郡臼田町（当時）が、「星の町うすだ」宣言に基づく星や宇宙にまつわる事業の一環として整備した。,2
2005年（平成17年）4月1日の4市町村合併により、佐久市に運営が引き継がれた。,2
開館日には毎夜、予約不要で参加できる一般向けの観望会を行う、全国的にも珍しい施設。,2
石燕による『今昔画図続百鬼』の解説文によれば、「御伽ばうこ」なる話に、歳を経た女の骸骨が牡丹の柄の入った提灯を持ち、生前恋していた男の家に通って男と交わる話がある、と述べられている。,2
すなわちこれは、浅井了意の著書『伽婢子』に収められている怪談『牡丹灯籠』の女の亡霊・弥子を描いたものである。,2
『伽婢子』によれば、萩原新之丞という男が美女の姿の弥子と出会い、毎晩のように情事を交わすが、ある晩に隣りの老人がそれを覗き見ると、それは新之丞と骸骨が抱き合っているという奇怪な場面だったという。,2
また、山田野理夫の著書『東北怪談の旅』にも、青森県の怪談として骨女という名の妖怪の話が登場する。,2
これは安政時代、周囲から醜いといわれていた女が、死後は骸骨の容姿が良いので、人々に見せるために町中を骸骨の姿で歩き回ったという。,2
魚の骨が好物で、高僧に出会うと崩れ落ちてしまうという。,2
ただし、この話の骨女は石燕の描いたものとは別であると指摘されている。,2
アナディリのウゴリヌイ空港からは、極東ロシアの主要都市や小都市とを結ぶ便が運航されており、ハバロフスク、ウラジオストク、モスクワと結ばれているほか、ベーリング航空が米国のアラスカ州ノームへのチャーター便を運航している。,2
さらには当地に伝承されてきた、たたら製鉄でつくり出される玉鋼は日本人の魂の象徴とされる日本刀の創始（安綱）ともかかわりが深く、最近では安本美典がこれら諸説を文献学的に比較し、島根/鳥取県境に最も近い安来市伯太町の比婆山を比定している。,2
広島県庄原市から島根県仁多郡奥出雲町境にある比婆山は現在、国定公園に指定されている。,2
中国山地中部にあり、比婆道後帝釈国定公園に属している。,2
比婆山連峰の最高峰は立烏帽子山 (1299 m) であり、比婆山といえばこれを指すこともあるが、立烏帽子山の北北西方向、標高1264 mのブナ林の中に円丘があり、伊邪那美命の御陵と伝えられる苔むした巨石が横たわっている。,2
この峰を特に比婆山あるいは比婆山御陵と呼ぶ場合もあり、国土地理院の2万5千万分の1地形図ではここを「比婆山」としている。,2
さらに烏帽子山（御陵の北西側・島根県境）、池ノ段（立烏帽子山の西側）、竜王山（立烏帽子山の南東側）に三等三角点が設置され、それぞれ「烏帽子山」1225.14 m、「立烏帽子」1279.46 m、「川奥」1255.84 mとなっている。,2
また烏帽子山の西にある吾妻山は、日本三百名山に選定されている。,2
竜王山の南西側山麓には伊邪那美命を祭った熊野神社があり、比婆山への参道の遥拝所にあたるとされる。,2
熊野神社の境内には、樹齢千年といわれる全国でも有数の巨杉がある。,2
北東側山麓の六の原にはたたら製鉄場跡があり復元展示され、県史跡に指定されている。,2
一帯はひろしま県民の森として整備され、宿泊施設、キャンプ場、スキー場がある。,2
比婆山連峰は、1970年に未確認動物であるヒバゴン目撃騒動の舞台となった。,2
他にも「玉抱石（盃状穴）」と呼ばれる穴の空いた不思議な霊石や「神籠石」などが見られる。,2
手術中は自発呼吸が十分でないことが多く、気道を保護するための介入が必要となることが多い。,2
全身麻酔は一般に手術室では患者にとって耐え難い痛みを伴う外科手術を可能にするために、集中治療室や救急外来では重症患者の気管挿管や機械換気を容易にするために実施される。,2
日本では、全身麻酔の目標は「麻酔の3要素」、すなわち鎮静・鎮痛・筋弛緩とされることが多い。,2
有害反射の抑制も加えて麻酔の4要素とされることもあるが、これは元はWoodbridgeらが1957年に提唱した麻酔深度の概念に遡ることができる。,2
英語圏では、意識消失、健忘、鎮痛、自律神経系の反射消失、場合によっては骨格筋の麻痺を達成することが全体目標とされることもある。,2
すなわち、4要素ないしは5要素となっており、鎮静において意識消失と健忘が別個の評価項目となっていることによる。,2
患者や処置に最適な麻酔薬の組み合わせは、麻酔科医が患者、外科医、歯科医師、または手術処置を行う他の施術者と相談しながら選択する。,2
現在では多様な気道確保器具が存在するが、かつては全身麻酔時の気道確保は、麻酔マスクないしは気管挿管に限られ、麻酔薬も吸入麻酔薬が主であったことから、後者が気管内麻酔法（intratracheal anesthesia）と呼ばれていたが、現在はこの名称は、ほぼ用いられない。,2
2世紀から3世紀に書かれた『三国志』には、中国後漢末期に華陀が「麻沸散」という麻酔薬を用いて手術を行ったと記載されている。,2
この「麻沸散」は全身麻酔薬であろうと考えられているが、どのようなものであったかは明らかではない。,2
中世には、東洋においてもヨーロッパにおいても科学は医学的に大きな進歩を遂げた。,2
ルネッサンス期には、解剖学と外科学に大きな進歩があった。,2
しかし、このような進歩にもかかわらず、手術は依然として最後の治療法であった。,2
手術は痛みを伴うため、多くの患者は手術を受けるよりも死を選んだ。,2
全身麻酔の発見については、誰が最も功績を残したかについて定説は無いが、18世紀後半から19世紀初頭にかけてのいくつかの科学的発見が、近代的麻酔技術の導入と発展に不可欠であった。,2
特に薬剤投与経路としての気体の吸入の開発が重要であった。,2
正確に確認できる全身麻酔の記録としては、文化元年10月13日（1804年11月14日）に華岡青洲が行った乳癌の手術が初出である。,2
このとき用いられた経口麻酔薬「通仙散」はチョウセンアサガオにトリカブトやトウキなどを配合した薬品であった。,2
西洋では、1846年にアメリカでウィリアム・T・G・モートンが行ったジエチルエーテル吸入による手術が初の全身麻酔手術となる。,2
エーテルは引火性が問題であり、すぐにクロロホルムに取って代わられたが、クロロホルムも毒性のために死者が相次ぎ、使われなくなるのに時間はかからなかった。,2
19世紀後半には、近代外科学への移行を可能にする二つの大きな飛躍があった。,2
病原菌の発見と麻酔である。,2
病気の病原体説の理解により、外科手術における感染予防技術の開発と応用が急速に進んだのである。,2
防腐法(英語: antisepsis)はやがて無菌法(英語: asepsis)に変わり、外科手術の合併症と死亡率は、以前の時代よりはるかに低くなった。,2
一方、この時期はエーテルなどの単一の揮発性麻酔薬を用いて、麻酔の4要素全てを達成する努力がなされたが、麻酔をかけるのに時間を要し、手術に必要な筋弛緩を得るには高濃度の麻酔薬が必要であった。,2
また、この吸入自体、麻酔薬の臭気のためもあり、一部の患者にとっては不快な経験であり、他の投与経路、例えば直腸や静脈から投与できる薬剤の試行錯誤が続いた。,2
1934年に、アメリカのアーネスト・ヴォルワイラーによって開発された静脈麻酔薬チオペンタールは、現在に至るまで全身麻酔薬として使用されており、WHOの必須医薬品リストにも指定されている。,2
チオペンタールなどの静脈麻酔薬によって、麻酔をかけるのに要する時間は短縮されたが、これらは呼吸抑制が強く循環抑制も強かったため、依然、死亡リスクが高かった。,2
20世紀には、気管挿管やその他の高度な気道確保技術を日常的に使用し、局所麻酔や複数の麻酔薬を組み合わせるバランス麻酔の概念が提唱され、全身麻酔の安全性と有効性が改善された。,2
また、モニタリングの大幅な進歩や、薬物動態学的および薬力学的特性が改善された新しい麻酔薬も、この傾向に貢献した。,2
全身麻酔は、大脳皮質、視床、網様体賦活系、脊髄を含む中枢神経系構成要素の機能を抑制・変化させるのが一般的である。,2
麻酔状態に関する現在の理論では、中枢神経系における標的部位だけでなく、無意識と関連した神経ネットワークや覚醒回路も特定されており、一部の麻酔薬は特定の睡眠活性部位を活性化する可能性があることが分かっている。,2
全身麻酔に用いられる薬剤のうち、オピオイドとベンゾジアゼピンは結合する受容体が特定され、作用機序が判明しているが、他の薬剤は未解明の部分が残っている。,2
全身麻酔は、神経信号の抑制性伝達を増強するか、あるいは興奮性伝達を減少させるという仮説が立てられた。,2
全身麻酔薬の主要な分子薬理学的標的は、GABAAとNMDAグルタミン酸受容体であると考えられている。,2
ほとんどの吸入麻酔薬はGABAAアゴニストであることが判明しているが、受容体への作用部位は不明なままである。,2
ケタミンは非競合的なNMDA受容体拮抗薬である。,2
吸入麻酔薬や静脈麻酔薬（プロポフォールやバルビツール系）は、麻酔作用を発揮するには、オピオイドやベンゾジアゼピンの数十倍から1000倍の組織内濃度を必要とする。,2
このことは、これらの麻酔薬の作用機序が特定の受容体への結合だけでは説明できない傍証となっている。,2
吸入麻酔薬は、化学構造と特性から、細胞膜を標的とすることも示唆されているが、その正確なメカニズムは100年以上謎のままであった。,2
