本文,Level
御病気なさったそうですね。回復されたのでしょうか？,1
本日は温かい気候ですね。,1
行ってらっしゃいませ。お気を付けて。,1
皆様、御揃いでお出かけになられるのですか？,1
本日はお早いのですね、お散歩ですか？,1
お早うございます。本日も良いお天気ですね。,1
お早うございます。早朝から御精が出ますね。,1
こんにちは、お暑うございます。本日は蒸しますね。,1
こんばんは、お寒うございます。随分ひえますね。,1
生憎の御天気ですね。はっきりとしない生憎の御天気ですね。,1
お寒うございます。本日はやけに冷えますね。,1
お久しぶりに、良いお湿りでございますね。,1
良いお天気ですね。ようやくお布団が干せますね。,1
随分、日が長くなりましたね。,1
日が短くなりましたね、まだ五時前なのに、薄暗いですね。,1
それは良いお考えでございますね。,1
全くもって、御説の通りでございます。,1
さようでございます。仰る通りです。,1
課長の御想像通りでございました。,1
それは正しい御判断だと存じます。,1
御説仰る通りでございます。,1
恐れ入ります、全く仰る通りでございます。,1
仰る通りです、私も同様に存じます。,1
参考になります、その様なお考えもございますね。,1
そちらで結構でございます。,1
御異議がないようでしたら、採決を取らせて頂きたいと存じます。,1
何卒、三分の二の御賛成を頂きたいと存じます。,1
その御考えに賛同いたします。,1
御賛同を頂きました、誠にありがとうございます。,1
御同意頂きまして、誠にありがとうございます。,1
貴殿がこちらの作品で特に意図なさったのは、どの様なところでしょうか？,1
奥様は優秀な方でいらっしゃいますが、御決断力が乏しいと存じます。,1
バラの花束に詩を添えて素晴らしい御考えですね。,1
グループ分けには、さぞ御苦心されたことと存じます。,1
こちらの新製品、随分、工夫された事と存じます。,1
曇らないフロントガラスを、御考案されたそうですね。,1
社長が、ナノ・ウォーターを御考案なさったのでしょうか？,1
宇宙戦争が舞台とは、何とも壮大な御構想でございますね。,1
映画での町興しを御構想なさったのは、先生でございますね。,1
それは素晴らしい御着眼でございますね。,1
人の気が付かないところに御着眼なさるのは、素晴らしいと存じます。,1
この一局は、勝負所の御着想が素晴らしいと存じます。,1
そんな斬新な御着想なさるのは、貴殿しかいらっしゃいません。,1
貴殿はいつも素晴らしい御発想をお持ちで、感銘致します。,1
土に溶ける新物質を御発明されたと存じます。,1
近々、またお目にかからせて頂きます。,1
宜しければ、本日中にお目にかからせて頂けませんでしょうか？,1
次にお目にかかる日を楽しみにしております。,1
またいつでも、お目にかかれます。,1
御子息にお会いできる日が待ち遠しい事と存じます。,1
あれ以来、長い事お目にかかっておりません。,1
翌日、御挨拶に伺います。堅苦しい御挨拶は結構でございます。,1
それでは、会長が一言、御挨拶申し上げます。,1
先生に、御挨拶なさいましたか？,1
あちら様が会釈なさってますが、お知り合いでございますか？,1
今貴殿にお辞儀なさった方は、どなたでございますか？,1
十年ぶりの御再会でございますか？,1
三社祭りで偶然に御再会されたのでございますか？,1
今回が初めての御対面でございますか？,1
十年越しの宿敵と御対面なさった御感想は？,1
お初にお目にかかります。,1
初めてお目にかかります、西方と申します。,1
お目にかかる事ができ光栄でございます。,1
先生には、以前お目にかかった事がございます。,1
いつも、御電話ばかりで大変恐縮です。,1
御噂は、かねがね伺っておりました。,1
申し遅れましたが、叔父の坂本と申します。,1
御挨拶が後回しになりまして、大変恐縮です。,1
御名刺を頂戴できますでしょうか？,1
大変貴重な御名前でいらっしゃいますね、何とお読みすれば宜しいでしょうか？,1
今後とも、宜しくお願い申し上げます。,1
どうぞ、以後お見知り置きを、お願い申し上げます。,1
今後ともお付き合いの程、宜しくお願い申し上げます。,1
貴重な御縁を、宜しくお願い申し上げます。,1
ようやく大使にお目通りが叶いました。,1
実は、貴殿にお会いになって頂きたい方がおります。,1
御二人が御会いになられるのは、お初でございますか？,1
宜しければ私に婿様のお手伝いをさせて頂けませんでしょうか？,1
貴殿の御仲介のおかげで、お目にかかる事ができました。,1
いつぞやお話させて頂いた館長殿に、御引き合わせ存じます。,1
どうぞ、お引き回し下さいませ。存分に、お引き回し下さいませ。,1
お見合いも二十回目となると、退屈なさる事でしょう？,1
よく写っていらっしゃいます、お見合い写真になさったらいかがでしょうか？,1
私、先日御紹介いただいた西方と申し上げます。,1
さようでございますか、そちらの道のエキスパートを御紹介致します。,1
人を御紹介なさる時は、よくお考えになった方が宜しいかと存じます。,1
大変光栄です、一度お目にかかりたいと思っておりました。,1
近々、お目にかかりたいと存じます。（手紙文）,1
奥方様に御目文字を賜りたく存じます。（手紙文）,1
ぜひ一度、奥様の御尊顔を拝したいと存じます。（手紙文）,1
まあ、ふくよかで可愛い赤ちゃんでいらっしゃいますね。,1
お食い初めに、お父様をお呼びになったらいかがでしょうか？,1
ご出産のお祝いに、おくるみをお贈りさせていただきます。,1
何事もなく、お七夜をお迎えすることができました。,1
赤ちゃんが、おしゃぶりを落とされたようですよ。,1
まあ、玉のような赤ちゃんでいらっしゃいますね。,1
三人もお産みになっておられるので、赤ちゃんのあやし方がお上手でいらっしゃいますね。,1
お産がお軽く済まれたようで、よろしかったですね。,1
娘様が、おめでたでいらっしゃるそうですね。,1
ご安産でいらしたそうで、よろしかったです。,1
ご出産おめでとうございます。初めてのお子様でいらしたそうですね。,1
ご予定日より、かなりお早くご出産なされたのですね？,1
奥様のお産にお立会いされて、いががでしたでしょうか？,1
もしかして、妊娠なさっておられるのではないでしょうか？,1
念願のお子様をお宿しになられたそうですね。,1
たまには羽目をはずされて、お遊びになられることも必要であると思われます。,1
社長様は応接室で、ご一局お囲みになられていらっしゃいます。,1
旦那様は小猫とお戯れになられておられます。,1
部長様、ご一局お手合わせいただけませんでしょうか？,1
先輩、どうぞお手柔らかにお願い申し上げます。,1
総長様のお道楽にも困っております。,1
あなた様のお出番でございます。カードをおめくりになられていただけますでしょうか。,1
先輩、ご一手ご指南、お願い申し上げます。,1
ご一勝ご一敗、こちらでお相子にいたしましょう。,1
私はお医者さんごっこなどは、致しませんでした。,1
お馬様には、いつも遊ばれております。,1
いいかげんに、お茶屋さんのお遊びをおやめになられたらいかがでしょうか。,1
おばあさまは、お手玉がお上手でいらっしゃるのですよ。,1
かるたでは、お手付きはだめでございますよ。,1
姉たちのおはじきのじゃまを致しまして、よく怒られましたものでございます。,1
まあ、シャツが絞れるほど汗をおかきになっておられます。,1
ずいぶん、汗をおかきになられるのですね。ご体質でいらっしゃいますか？,1
お暑うございます。一雨いただきたいですね。本日もお暑うございますね。,1
お暑いですね。こちらでお涼みになられるとよいかと思います。,1
先生は、お庭の東屋で涼まれるのがお好きでいらっしゃいました。,1
お寒い夜は、湯たんぽでお温もりになられるのが一番でございます。,1
本日は冷えますので、温泉でゆっくり温まれると良いと思われますよ。,1
南極で越冬なされるのでしょうか、それは大変なお仕事でいらっしゃいますね。,1
本日はお寒いので、カイロをおいれになってはいかがでしょうか？,1
冬のラグビーのご観戦には、お膝におくるみになる物をお忘れになりませんように。,1
お寒くございませんでしょうか。お寒うございますね。雪になりそうでございますね。,1
お濡れになられますから、傘をお持ちになってください。,1
雨に濡れられて、お冷えになられたのではございませんか？,1
おこたに入られて、おみかんでもいただきましょう。,1
お火鉢を跨がれるなんて、お行儀がよろしくないと思われますよ。,1
ご一族がご一堂に会されるのは、久々でいらっしゃるそうですね。,1
次のお集りの時に、ご細目をお知らせさせていただきます。,1
皆様、あちらでお集りになられておられます。,1
皆様、お揃いになられましたでしょうか。お揃いになられるまでお待ちいたしましょう。,1
シャンソンのお好きな方々が、お集いになられるそうですよ。,1
記念日には、ご創業時のメンバー様が集われるご予定でございます。,1
グループのご結成十周年とお伺いいたしました。早いものでございます。,1
また新たにチームをご結成なさるのでしょうか、それは楽しみでございます。,1
新人歓迎会に、どうぞご参集くださいますようお願い申し上げます。,1
ご集合のお時間をお忘れになられませんようにお願い申し上げます。,1
八重洲口の銀の鈴にご集合なさっていただきますようお願いいたします。,1
次のお集りからは、お料理はお持ちよりにいたしましょう。,1
ご必要なメンバーは、私がお集め致しましょう。,1
これだけのワインをお揃えになるのは、大変でございましたでしょう。,1
連句のお仲間を、お募りになっておられるのでしょうか？,1
ここはひとつ、あなた様が頭をお下げになられた方がよろしいのではないでしょうか？,1
先日のことは、彼女にお謝りになられたのでしょうか？,1
どうか、お見逃しいただけますでしょうか。ほんの出来心であるようなのです。,1
この件は、どうぞお目こぼしのほどを、おねがい申し上げます。,1
例の件、お許しをいただきたく思っているのですが？,1
この度のこと、どうぞお許し願いたいと思っております。,1
お詫びの申し上げようもございません。,1
失礼がございましたら、お詫び申し上げます。,1
例の件、どうかご寛恕賜りたく、お願い申し上げます。,1
どうぞ、ご寛大なご処置を、お願い申し上げます。,1
二度といたしませんので、どうぞお許し下さいますようお願い申し上げます。,1
理事長のご寛容なご処置には、尊敬いたしました。,1
ご無礼は承知の上で参上いたしました。ご無礼をどうぞお許し願います。,1
気がつきませんでして、ご無礼をおゆるしください。,1
何とぞ、ご容赦くださいますようお願い申し上げます。平に、ご容赦くださいませ。,1
この度は、誠に申し訳ございません。,1
この度の失態は、誠に遺憾でございます。,1
とんでもない失態をいたしまして、言葉もございません。,1
お聞き苦しいところを、お聞かせいたしまして、申し訳ございません。,1
私の言葉がお気に障ったようでしたら、お詫び申し上げます。,1
とんでもないお粗末をいたしてしまいました。,1
お見苦しい所をお見せいたしまして、申し訳ございません。,1
どうか、お見捨てがございませんよう、お願い申し上げます。,1
お耳障りかと存じますが、しばらくの間、ご辛抱いただけますでしょうか。,1
お片付け致しましょうか。お目障りではございませんか？,1
つまらぬ事でお騒がせいたしまして、申し訳ございません。,1
至りませんでしたようで、申し訳ございません。,1
気が利きませんでしたようで、本当に申し訳ございません。,1
うっかりいたしておりまして、気がつきませんで、申し訳ございません。,1
行き届きませんでしたようで、どうしてよいかわからず、申し訳ございません。,1
この度は、大変ご迷惑をおかけしてしまい、申し訳ございませんでした。,1
三十分も遅れてしまい、申し訳ございません。,1
せっかくでございますが、私は飲むことができません。申し訳ございません。,1
この度は、ご面倒をおかけして申し訳ございませんでした。,1
失礼いたしました。失礼いたします、前を通らせていただきたいと思います。,1
国民文化祭の「連句」にご応募願います。,1
応募された論文が入賞したとお聞きしました。,1
特許出願の手続きは、もう済まされましたか。,1
画期的な発明でいらっしゃいますね、特許を出願された方がよろしいかと存じます。,1
この度出展される絵は、何号になりますか。,1
この度ご出品いただけたこと、心より感謝いたします。,1
公募展に出品されたらどうでしょうか。,1
久々のご出展、楽しみに致しております。,1
投稿された句が、今朝の新聞に載ってらっしゃいましたね。,1
この際、巡り合わせと思って表彰をお受けになったらいかがですか。,1
受賞記念パーティーには出席させていただきたく存じます。,1
執念ですね、ついに賞を受賞されるとは。,1
念願のご入選、お祝い申し上げます。,1
入選されたのは、今度で何回目になりますか。,1
国体のスキーで、入賞されたことがあるとお聞きしました。,1
お気詰まりとは存じますが、もうしばらくのご辛抱を。,1
義理のチョコレートとはいえ、嬉しくなりますね。,1
ここはひとつ、堪えていただけますか、この私に免じて。,1
ご主人の回復を願って、好きなコーヒーをお断ちになられたのですか？,1
ご指示のあるまで、ご連絡は控えさせていただきます。,1
アルコールはしばらく、控えられた方がいいですよ。,1
夜のお付き合いを、少しお減らしになったらいかがですか。,1
数値がもう少し下がるまで、お酒は我慢されたらどうでしょう。,1
義理だとしてもご兄弟なら、気兼ねなさる必要ないと思います。,1
もう一、二年ご辛抱をお願いします。,1
もう少し辛抱されるのは難しいでしょうか。,1
どういった理由で自粛されているのでしょうか。,1
ご立腹だとは存じますが、ここはご自重ください。,1
お似合いの品を、私がお選びしましょうか？,1
お客様のお好きなお支払い方法をお選びいただけます。,1
いい人をお選びになったのですね。,1
あなたのお見立てでしたら間違いないはずです。,1
プレゼントですか？良さそうなものを見立てましょうか？,1
さすがにお目が高いですね、勉強になります。,1
ご吟味は、もう済まされましたか？,1
十分に吟味された方がよろしいかと思います。,1
まあ、特定のものを選ぶのは〇〇さんの自由なのですが…。,1
あなたのご選択で間違いありません。,1
最強のメンバーを選抜されたんですね、監督！,1
応募作品をご選考ください。,1
りんごは、糖度で選別のだそうで。,1
どちらも捨てがたい、迷われるのは当然のことです。,1
素敵な男性が揃った場合、目移りすることもあるでしょうね。,1
どうか、お煙草はご遠慮いただけますでしょうか。,1
遠慮なんてなさらず、ご自分でお決めください。,1
明日ですが、午後一時にご来社ください、とのことをお伝えします。,1
お客様を応接間に、お通ししました。,1
ただいま、お取り次ぎしますので、少々お待ちいただけますでしょうか。,1
小説家の先生が、いらっしゃいました。,1
応接間にご案内いたします。どうぞこちらの方へ…。,1
あの方はどなたにも穏やかに対応されるのですね。,1
貴社の成長の秘訣は、どこにあるのでしょうか。,1
御社のご担当者様に、お伝えいただけますでしょうか？,1
貴社におかれましては、ますますのご清栄のことと存じますます。,1
当社に限りまして、そのような偽装はあり得ません。,1
石の上にも三年、弊社もついに軌道に乗ったところです。,1
弊社が社運を賭けた新製品を発表させていただきます。,1
ただいま、係りの者が参りますので。,1
担当の者をお呼びしました。,1
お客様がいらっしゃいました。,1
お客様のお名前を頂戴できますでしょうか？,1
本日は、お約束でしょうか？,1
ご訪問の趣旨を、お聞きしてもよろしいでしょうか？,1
お急ぎのご用件でしょうか？,1
ご用件をお伺いしてもよろしいでしょうか？,1
こちらにいらっしゃったのは、どういったご用件からでしょうか？,1
私で問題ございませんでしたら承ります。,1
さようでございますか。いましばらくお待ちください。,1
ご面会の受付はこちらで承ります。,1
私に何なりとおっしゃってください。,1
ご入用のものがございまそたら、おっしゃってください。,1
取材旅行には、ワゴン車がご入用とお伺いしました。,1
すべてお揃いでよろしいでしょうか？,1
ご用事がお済みになるまで、こちらでお待ちしております。,1
お申し付けくださり、ありがとうございます。,1
落成式にはぜひ出席させていただきたく存じます。,1
お祝い返しの品を選びに行って参りました。,1
父の米寿のお祝い事ですので、どうぞお気兼ねなさらず。,1
謹んでお慶申し上げます。,1
それでは、ご友人の方から、お祝いのお言葉を賜りたく存じます。,1
先方の顔を思い浮かべながら、お祝いの品を選ぶのは喜ばしいことですね。,1
早速ですが、お祝いの席を設けたいと思います。,1
お祝い品を持って参りました。,1
誕生祝いに、ベビーシューズを二足だなんて心配りが利いていますね。,1
それでは、会長からお祝いのご挨拶を頂戴いたします。,1
ご祝儀は、短い方が感じがいいですよ。,1
ご祝儀袋は、中身相応のものでよいかと思います。,1
当選の祝宴は、ご盛況でしたね。,1
故郷では、祝賀行事が続いているのだそうですね。,1
この度はおめでとうございます。お二人のご多幸をお祈りいたします。,1
これからのサッカー人生が幸多からんことをお祈りします。,1
昇進で、第一子誕生に花を添えることができましたね。,1
謹んでお慶び申し上げます。,1
貴店のますますのご発展、ご繁栄をお祈り申し上げます。,1
それは何よりです、幸運に恵まれたのですね。,1
どうぞお許しください。,1
こちらの間違いでご迷惑をおかけし、大変申し訳ございません。,1
このたびは失礼をおかけして、大変申し訳ございません。,1
落選は、私の力不足によるものでした。,1
私に免じてお許しください。,1
私が至らなくてこんな事態になって申し訳ないです。,1
お部屋の家具を全部新しくされたんですね。,1
その方針はやめられたほうがいいと思います。,1
息子さん帰省されたのですね今朝港でお見掛けしました。,1
先生がご挨拶にいらっしゃいました。,1
浅草では荷風先生をよく見かけました。,1
表通りに開店したフレンチの店、評判はどうですか,1
先生は市民の食習慣を改善されました。,1
病気予防のためにも、食生活を改善されたほうがいいでしょう。,1
この製品を改良されるのは何年ぶりですか？,1
許可証の更新は早めにお願いいたします。,1
まだ車の免許を更新される頃ではありませんか。,1
今後、態度を改められるようにお願いいたします,1
総理、いつ内閣を改造されるつもりですか？,1
いよいよ、政治の世界に転身されるんですね。,1
なるほどやっぱり、いらっしゃった,1
春の園遊会で、お姿を見かけました,1
旅行されてたの？暫くお見掛けしなかったわね。,1
師匠は人前に出るのが好きではありません。,1
よくそんなところへ、行かれたもんですね,1
これはこれは、珍しい人がいらした,1
待ってください。そんなに早く歩かないでください,1
驚きました、二駅も歩くのですか,1
パジャマであちこち歩き回るのではたいへんですね,1
お召し物を汚さないように、気を付けて進まれてください,1
初めてパリの町を闊歩されて気分はどうでしたか？,1
老師は山寺で自由に散策を楽しんでいらっしゃいます。,1
コスモス畑を散策するのも悪くありませんよ。,1
お客様、お散歩には海辺がいいと思います。,1
犬と一緒に散歩されるのが院長先生の日課です。,1
毎週同一路線を往復する人には、割引があるという話です,1
英会話教室に、通っておられるそうですね,1
あの店によく行かれているのは、何か目的がおありなんでしょ,1
今日はどちらに回られるんですか？,1
火の用心で町内を巡回するんですか？,1
もう問題ありませんので、安心してください,1
就職が決まって、ご両親も安堵されたでしょう,1
もう大丈夫、峠は越えたので安心されてください,1
娘さんが結婚されて、安心されたんじゃないでしょうか,1
お仕事がひと段落して、ようやく落ち着かれますね,1
息子さんが帰国されて、心強いことですね,1
ご主人が戻られて安心されましたね,1
どうぞ心を安らかにされてください,1
ご隠居は、安らかな顔で寝ていらっしゃいます,1
ご子息の勤務先が決まって、肩の荷が下りましたね,1
ケガも軽くて、ほっとされたことでしょう,1
大事に至らなくて、校長も安心されています,1
坊ちゃんが店を継がれるとは良かったですね。これで安泰です。,1
こんな時代でも、御社はゆるぎなくてけっこうですね。,1
肝機能の数値もいいから、このまま安定だといいですね,1
ご不満があるようでしたら、はっきりと一言おっしゃってください,1
僧正は、今の場所でがんばることが一所懸命だと申されました,1
そんなことを急に言いだれても困りますわ、どうされましたか？,1
お客様が腹を立てられるのは、ごもっともです。,1
温厚なあの方が激怒するとは、よほどのことですね。,1
あたなのお話も理解出来ます。,1
威張った言い方、もう1回言ってみなさい!,1
私には、身の丈に合わないお言葉です。,1
皇后様は、避難している全員に安心出来る言葉を下さいました。,1
ご自分の意見を真っすぐにおっしゃいましたね。,1
ここは、ご自分の意見をはっきりおっしゃるべきですよ。,1
あなたのご考えは今年も見事でしたね。,1
本当に申しづらいのですが、今年の選挙は不合格です。,1
